{
  "$schema": "https://raw.githubusercontent.com/iamcamiel/ibm360ald/main/schema/ALD_v4.json",
  "page": {
    "page": "DS201",
    "page-type": "ALD",
    "origin": "scan",
    "title": [
      "NORMAL BRANCH SET ROSAR BIT 10",
      "PER ROS SENSE LTH BITS 57-61"
    ],
    "date": "08-14-69",
    "machine": "7201-02",
    "log": "153",
    "frame": "02",
    "p/n": "2584837",
    "ibm division": "SDD",
    "next block": "BJ",
    "revisions": [
      {
        "date": "08-08-69",
        "num": "713380"
      }
    ]
  },
  "review": {
    "status": "partial",
    "approved": false,
    "unresolved discrepancies": true,
    "details": "review/DS/DS201.json"
  },
  "blocks": [
    {
      "serial": "AA",
      "grid position": "1C",
      "function": "AR",
      "circuit": "T06AA",
      "card": "3630",
      "portion": "A5",
      "socket": "02C-B3L4",
      "pins": [
        {
          "side": "L",
          "line": 4,
          "pin": "B05"
        },
        {
          "side": "R",
          "line": 2
        },
        {
          "side": "R",
          "line": 4,
          "pin": "B05"
        }
      ]
    },
    {
      "serial": "AB",
      "grid position": "2F",
      "function": "AR",
      "circuit": "T06AA",
      "card": "3630",
      "portion": "AC",
      "socket": "02C-B3L4",
      "pins": [
        {
          "side": "L",
          "line": 4,
          "pin": "D06"
        },
        {
          "side": "R",
          "line": 2
        },
        {
          "side": "R",
          "line": 4,
          "pin": "D06"
        }
      ]
    },
    {
      "serial": "AC",
      "grid position": "2C",
      "function": "AR",
      "circuit": "T06AA",
      "card": "3630",
      "portion": "A7",
      "socket": "02C-B3L4",
      "pins": [
        {
          "side": "L",
          "line": 4,
          "pin": "B12"
        },
        {
          "side": "R",
          "line": 2
        },
        {
          "side": "R",
          "line": 4,
          "pin": "B12"
        }
      ]
    },
    {
      "serial": "AE",
      "grid position": "3G",
      "function": "AR",
      "circuit": "T06AA",
      "card": "3630",
      "portion": "AE",
      "socket": "02C-B3L4",
      "pins": [
        {
          "side": "L",
          "line": 4,
          "pin": "D09"
        },
        {
          "side": "R",
          "line": 2
        },
        {
          "side": "R",
          "line": 4,
          "pin": "D09"
        }
      ]
    },
    {
      "serial": "AF",
      "grid position": "2L",
      "function": "AR T",
      "circuit": "T06AA",
      "card": "3630",
      "portion": "A9",
      "socket": "02C-B3J4",
      "pins": [
        {
          "side": "L",
          "line": 4,
          "pin": "D13"
        },
        {
          "side": "R",
          "line": 2
        },
        {
          "side": "R",
          "line": 4,
          "pin": "D13"
        }
      ]
    },
    {
      "serial": "AG",
      "grid position": "2N",
      "function": "AR T",
      "circuit": "T06AA",
      "card": "3630",
      "portion": "AE",
      "socket": "02C-B3J4",
      "pins": [
        {
          "side": "L",
          "line": 4,
          "pin": "D09"
        },
        {
          "side": "R",
          "line": 2
        },
        {
          "side": "R",
          "line": 4,
          "pin": "D09"
        }
      ]
    },
    {
      "serial": "AH",
      "grid position": "3B",
      "function": "AR T",
      "circuit": "T06AA",
      "card": "3630",
      "portion": "A1",
      "socket": "02C-B3L4",
      "pins": [
        {
          "side": "L",
          "line": 4,
          "pin": "B04"
        },
        {
          "side": "R",
          "line": 2
        },
        {
          "side": "R",
          "line": 4,
          "pin": "B04"
        }
      ]
    },
    {
      "serial": "AJ",
      "grid position": "3E",
      "function": "AR",
      "circuit": "T06AA",
      "card": "3630",
      "portion": "A9",
      "socket": "02C-B3L4",
      "pins": [
        {
          "side": "L",
          "line": 4,
          "pin": "D13"
        },
        {
          "side": "R",
          "line": 2
        },
        {
          "side": "R",
          "line": 4,
          "pin": "D13"
        }
      ]
    },
    {
      "serial": "AK",
      "grid position": "3J",
      "function": "AR T",
      "circuit": "T06AA",
      "card": "3630",
      "portion": "A7",
      "socket": "02C-B3J4",
      "pins": [
        {
          "side": "L",
          "line": 4,
          "pin": "B12"
        },
        {
          "side": "R",
          "line": 2
        },
        {
          "side": "R",
          "line": 4,
          "pin": "B12"
        }
      ]
    },
    {
      "serial": "AL",
      "grid position": "3L",
      "function": "AR T",
      "circuit": "T06AA",
      "card": "3630",
      "portion": "AC",
      "socket": "02C-B3J4",
      "pins": [
        {
          "side": "L",
          "line": 4,
          "pin": "D06"
        },
        {
          "side": "R",
          "line": 2
        },
        {
          "side": "R",
          "line": 4,
          "pin": "D06"
        }
      ]
    },
    {
      "serial": "AM",
      "grid position": "4B",
      "function": "A",
      "circuit": "U03AI",
      "card": "3630",
      "portion": "A2",
      "socket": "02C-B3L4",
      "pins": [
        {
          "side": "L",
          "line": 2
        },
        {
          "side": "L",
          "line": 4,
          "pin": "B02"
        },
        {
          "side": "L",
          "line": 6,
          "pin": "D04"
        },
        {
          "side": "R",
          "line": 4
        }
      ]
    },
    {
      "serial": "AN",
      "grid position": "4C",
      "function": "A",
      "circuit": "U03AI",
      "card": "3630",
      "portion": "A3",
      "socket": "02C-B3L4",
      "pins": [
        {
          "side": "L",
          "line": 2
        },
        {
          "side": "L",
          "line": 4,
          "pin": "D05"
        },
        {
          "side": "L",
          "line": 6,
          "pin": "B03"
        },
        {
          "side": "R",
          "line": 4
        }
      ]
    },
    {
      "serial": "AP",
      "grid position": "4D",
      "function": "A",
      "circuit": "U03AI",
      "card": "3630",
      "portion": "A6",
      "socket": "02C-B3L4",
      "pins": [
        {
          "side": "L",
          "line": 2
        },
        {
          "side": "L",
          "line": 4,
          "pin": "B10"
        },
        {
          "side": "L",
          "line": 6,
          "pin": "D11"
        },
        {
          "side": "R",
          "line": 4
        }
      ]
    },
    {
      "serial": "AQ",
      "grid position": "4E",
      "function": "A",
      "circuit": "U03AI",
      "card": "3630",
      "portion": "A8",
      "socket": "02C-B3L4",
      "pins": [
        {
          "side": "L",
          "line": 2
        },
        {
          "side": "L",
          "line": 4,
          "pin": "B09"
        },
        {
          "side": "L",
          "line": 6,
          "pin": "D12"
        },
        {
          "side": "R",
          "line": 4
        }
      ]
    },
    {
      "serial": "AR",
      "grid position": "4F",
      "function": "A",
      "circuit": "U03AI",
      "card": "3630",
      "portion": "AA",
      "socket": "02C-B3L4",
      "pins": [
        {
          "side": "L",
          "line": 2
        },
        {
          "side": "L",
          "line": 4,
          "pin": "B08"
        },
        {
          "side": "L",
          "line": 6,
          "pin": "D10"
        },
        {
          "side": "R",
          "line": 4
        }
      ]
    },
    {
      "serial": "AS",
      "grid position": "4G",
      "function": "A",
      "circuit": "U03AI",
      "card": "3630",
      "portion": "AD",
      "socket": "02C-B3L4",
      "pins": [
        {
          "side": "L",
          "line": 2
        },
        {
          "side": "L",
          "line": 4,
          "pin": "D07"
        },
        {
          "side": "L",
          "line": 6,
          "pin": "B07"
        },
        {
          "side": "R",
          "line": 4
        }
      ]
    },
    {
      "serial": "AT",
      "grid position": "5C",
      "function": "OR OR",
      "circuit": "U03AJ",
      "card": "3630",
      "portion": "A4",
      "socket": "02C-B3L4",
      "pins": [
        {
          "side": "L",
          "line": 2
        },
        {
          "side": "L",
          "line": 4
        },
        {
          "side": "L",
          "line": 6
        },
        {
          "side": "R",
          "line": 4,
          "edge": "negative",
          "pin": "D02"
        }
      ],
      "annotation": "K15 K16 K18",
      "annotation offset": [
        -3,
        -1
      ]
    },
    {
      "serial": "AU",
      "grid position": "5E",
      "function": "OR OR",
      "circuit": "U03AL",
      "card": "3630",
      "portion": "AB",
      "socket": "02C-B3L4",
      "pins": [
        {
          "side": "L",
          "line": 2
        },
        {
          "side": "L",
          "line": 4
        },
        {
          "side": "L",
          "line": 6
        },
        {
          "side": "R",
          "line": 4,
          "edge": "negative",
          "pin": "D02"
        }
      ],
      "annotation": "K17 K20 K19",
      "annotation offset": [
        -3,
        -1
      ]
    },
    {
      "serial": "AV",
      "grid position": "5G",
      "function": "A",
      "circuit": "U03AI",
      "card": "3630",
      "portion": "A2",
      "socket": "02C-B3J4",
      "pins": [
        {
          "side": "L",
          "line": 2
        },
        {
          "side": "L",
          "line": 4,
          "pin": "B02"
        },
        {
          "side": "L",
          "line": 6,
          "pin": "D04"
        },
        {
          "side": "R",